{
  "schema_version": "extended_detector_rule_v2",
  "detector_id": "D37",
  "vulnerability_type": "旧版本兼容分支导致的权限绕过",
  "canonical_template_id": "C02-authz-bypass",
  "source_rules": [
    "legacy/version/deprecated branch"
  ],
  "sink_rules": [
    "compat handler/service"
  ],
  "sanitizer_validator_rules": [
    "same authz as current path"
  ],
  "authn_rules": [
    "actor"
  ],
  "authz_rules": [
    "old/new policy parity"
  ],
  "tenant_rules": [
    "tenant filter parity"
  ],
  "evidence_requirements": {
    "candidate": [
      "local file path and line or artifact hash",
      "source or sink signal",
      "detector match reason"
    ],
    "needs_review": [
      "candidate evidence plus mapped route/handler or runtime artifact placeholder",
      "false-positive notes",
      "human review reason"
    ],
    "confirmed": [
      "static code evidence",
      "non-destructive dynamic evidence",
      "request/response summary",
      "positive and negative/blocked control",
      "role/tenant context when applicable",
      "evidence manifest",
      "quality gate pass"
    ]
  },
  "non_destructive_validation": [
    "use local authorized fixture or user-owned project only",
    "capture baseline request/response summary",
    "mutate only canary/test IDs or safe parameters",
    "verify blocked/negative control without reading sensitive data",
    "write evidence manifest and run quality gate"
  ],
  "fixtures": {
    "positive": "_shared/tests/fixtures/extended_40/D37-positive.json",
    "negative": "_shared/tests/fixtures/extended_40/D37-negative.json",
    "blocked": "_shared/tests/fixtures/extended_40/D37-blocked.json",
    "human_review": "_shared/tests/fixtures/extended_40/D37-human_review.json"
  },
  "report_template_mapping": "_shared/vulnerability_templates/canonical_23/C02-authz-bypass/REPORT_TEMPLATE.md",
  "quality_gate_weight": 75,
  "claim_policy": "extended detector emits candidate/needs_review only; confirmed requires executed dynamic evidence and quality gate",
  "validation_contract": {
    "emits_confirmed": false,
    "candidate_output_schema": "schemas/detector_output.schema.json",
    "requires_dynamic_evidence_for_confirmed": true,
    "requires_role_matrix_for_authz_confirmed": true,
    "requires_tenant_matrix_for_tenant_confirmed": false,
    "requires_evidence_id_for_every_claim": true,
    "requires_secret_redaction_before_report": true,
    "dataflow_policy": "keyword_or_same_file_signals are candidate-only; graph/dataflow confidence must be stated explicitly"
  },
  "sample_coverage": {
    "positive": "_shared/tests/fixtures/extended_40/D37-positive.json",
    "negative": "_shared/tests/fixtures/extended_40/D37-negative.json",
    "blocked": "_shared/tests/fixtures/extended_40/D37-blocked.json",
    "human_review": "_shared/tests/fixtures/extended_40/D37-human_review.json"
  }
}
